{
  "admissions": [
    {
      "resource_type": "writeup",
      "url": "https://blog.siguza.net/psychicpaper/"
    },
    {
      "resource_type": "writeup",
      "url": "https://blog.siguza.net/APRR/"
    },
    {
      "resource_type": "writeup",
      "url": "https://blog.siguza.net/PAN/"
    }
  ],
  "corpus": "r4b1t-cybersecurity-v1",
  "family": "independent_research",
  "rationale": "Individual technical writeups examining signature parsing or hardware memory-access protections; not profile or release navigation.",
  "schema": "r4b1t-reviewed-source-index-v1",
  "scope": "cybersecurity",
  "snapshot_digest": "sha256:fa24c4dbb9593931fe7005cf5f7ebc0234d04230f16504a9fcd67b3a86ac82dd",
  "snapshot_path": "corpus/indexes/strange-siguza-v1.json",
  "source_id": "strange-siguza-v1"
}
