{
  "admissions": [
    {
      "resource_type": "research",
      "url": "https://cs-people.bu.edu/tromer/radioexp/"
    },
    {
      "resource_type": "research",
      "url": "https://cs-people.bu.edu/tromer/ecdh/"
    },
    {
      "resource_type": "research",
      "url": "https://cs-people.bu.edu/tromer/mobilesc/"
    }
  ],
  "corpus": "r4b1t-cybersecurity-v1",
  "family": "academic_research",
  "rationale": "Author-linked project writeups describing low-bandwidth electromagnetic and mobile-device physical side channels.",
  "schema": "r4b1t-reviewed-source-index-v1",
  "scope": "cybersecurity",
  "snapshot_digest": "sha256:a4675d5317f73891ebffec6d59aad80340c90c3cb3c6f66dd9a34812bd3a7e62",
  "snapshot_path": "corpus/indexes/strange-tromeracoustic-v1.json",
  "source_id": "strange-tromeracoustic-v1"
}
