{
  "admissions": [
    {
      "resource_type": "writeup",
      "url": "https://www.malware-traffic-analysis.net/2024/01/08/index.html"
    },
    {
      "resource_type": "writeup",
      "url": "https://www.malware-traffic-analysis.net/2024/01/09/index.html"
    },
    {
      "resource_type": "writeup",
      "url": "https://www.malware-traffic-analysis.net/2024/01/12/index.html"
    },
    {
      "resource_type": "writeup",
      "url": "https://www.malware-traffic-analysis.net/2024/01/17/index.html"
    },
    {
      "resource_type": "writeup",
      "url": "https://www.malware-traffic-analysis.net/2024/01/19/index.html"
    },
    {
      "resource_type": "writeup",
      "url": "https://www.malware-traffic-analysis.net/2024/01/23/index.html"
    },
    {
      "resource_type": "writeup",
      "url": "https://www.malware-traffic-analysis.net/2024/01/25/index.html"
    },
    {
      "resource_type": "writeup",
      "url": "https://www.malware-traffic-analysis.net/2024/01/30/index.html"
    },
    {
      "resource_type": "writeup",
      "url": "https://www.malware-traffic-analysis.net/2024/02/08/index.html"
    },
    {
      "resource_type": "writeup",
      "url": "https://www.malware-traffic-analysis.net/2024/02/14/index.html"
    },
    {
      "resource_type": "writeup",
      "url": "https://www.malware-traffic-analysis.net/2024/02/21/index.html"
    },
    {
      "resource_type": "writeup",
      "url": "https://www.malware-traffic-analysis.net/2024/02/23/index.html"
    },
    {
      "resource_type": "writeup",
      "url": "https://www.malware-traffic-analysis.net/2024/03/06/index.html"
    },
    {
      "resource_type": "writeup",
      "url": "https://www.malware-traffic-analysis.net/2024/03/07/index.html"
    },
    {
      "resource_type": "writeup",
      "url": "https://www.malware-traffic-analysis.net/2024/03/13/index.html"
    },
    {
      "resource_type": "writeup",
      "url": "https://www.malware-traffic-analysis.net/2024/03/14/index.html"
    },
    {
      "resource_type": "writeup",
      "url": "https://www.malware-traffic-analysis.net/2024/03/19/index.html"
    },
    {
      "resource_type": "writeup",
      "url": "https://www.malware-traffic-analysis.net/2024/03/26/index.html"
    },
    {
      "resource_type": "writeup",
      "url": "https://www.malware-traffic-analysis.net/2024/04/04/index.html"
    },
    {
      "resource_type": "writeup",
      "url": "https://www.malware-traffic-analysis.net/2024/04/05/index.html"
    },
    {
      "resource_type": "writeup",
      "url": "https://www.malware-traffic-analysis.net/2024/04/09/index.html"
    },
    {
      "resource_type": "writeup",
      "url": "https://www.malware-traffic-analysis.net/2024/04/15/index.html"
    },
    {
      "resource_type": "writeup",
      "url": "https://www.malware-traffic-analysis.net/2024/04/17/index.html"
    },
    {
      "resource_type": "writeup",
      "url": "https://www.malware-traffic-analysis.net/2024/04/18/index.html"
    },
    {
      "resource_type": "writeup",
      "url": "https://www.malware-traffic-analysis.net/2024/05/09/index.html"
    },
    {
      "resource_type": "writeup",
      "url": "https://www.malware-traffic-analysis.net/2024/05/14/index.html"
    },
    {
      "resource_type": "writeup",
      "url": "https://www.malware-traffic-analysis.net/2024/06/08/index.html"
    },
    {
      "resource_type": "writeup",
      "url": "https://www.malware-traffic-analysis.net/2024/06/10/index.html"
    },
    {
      "resource_type": "writeup",
      "url": "https://www.malware-traffic-analysis.net/2024/06/11/index.html"
    },
    {
      "resource_type": "writeup",
      "url": "https://www.malware-traffic-analysis.net/2024/06/12/index.html"
    },
    {
      "resource_type": "writeup",
      "url": "https://www.malware-traffic-analysis.net/2024/06/17/index.html"
    },
    {
      "resource_type": "writeup",
      "url": "https://www.malware-traffic-analysis.net/2024/06/24/index.html"
    },
    {
      "resource_type": "writeup",
      "url": "https://www.malware-traffic-analysis.net/2024/06/25/index.html"
    },
    {
      "resource_type": "writeup",
      "url": "https://www.malware-traffic-analysis.net/2024/07/23/index.html"
    },
    {
      "resource_type": "writeup",
      "url": "https://www.malware-traffic-analysis.net/2024/08/08/index.html"
    },
    {
      "resource_type": "writeup",
      "url": "https://www.malware-traffic-analysis.net/2024/08/12/index.html"
    },
    {
      "resource_type": "writeup",
      "url": "https://www.malware-traffic-analysis.net/2024/08/26/index.html"
    },
    {
      "resource_type": "writeup",
      "url": "https://www.malware-traffic-analysis.net/2024/08/29/index.html"
    },
    {
      "resource_type": "writeup",
      "url": "https://www.malware-traffic-analysis.net/2024/08/30/index.html"
    },
    {
      "resource_type": "writeup",
      "url": "https://www.malware-traffic-analysis.net/2024/09/11/index.html"
    },
    {
      "resource_type": "writeup",
      "url": "https://www.malware-traffic-analysis.net/2024/09/12/index.html"
    },
    {
      "resource_type": "writeup",
      "url": "https://www.malware-traffic-analysis.net/2024/09/16/index.html"
    },
    {
      "resource_type": "writeup",
      "url": "https://www.malware-traffic-analysis.net/2024/09/17/index.html"
    },
    {
      "resource_type": "writeup",
      "url": "https://www.malware-traffic-analysis.net/2024/09/19/index.html"
    },
    {
      "resource_type": "writeup",
      "url": "https://www.malware-traffic-analysis.net/2024/10/01/index.html"
    },
    {
      "resource_type": "writeup",
      "url": "https://www.malware-traffic-analysis.net/2024/10/03/index.html"
    },
    {
      "resource_type": "writeup",
      "url": "https://www.malware-traffic-analysis.net/2024/10/07/index.html"
    },
    {
      "resource_type": "writeup",
      "url": "https://www.malware-traffic-analysis.net/2024/10/17/index.html"
    },
    {
      "resource_type": "writeup",
      "url": "https://www.malware-traffic-analysis.net/2024/10/23/index.html"
    },
    {
      "resource_type": "writeup",
      "url": "https://www.malware-traffic-analysis.net/2024/11/14/index.html"
    },
    {
      "resource_type": "writeup",
      "url": "https://www.malware-traffic-analysis.net/2024/11/24/index.html"
    },
    {
      "resource_type": "writeup",
      "url": "https://www.malware-traffic-analysis.net/2024/12/04/index.html"
    },
    {
      "resource_type": "writeup",
      "url": "https://www.malware-traffic-analysis.net/2024/12/17/index.html"
    },
    {
      "resource_type": "writeup",
      "url": "https://www.malware-traffic-analysis.net/2024/12/18/index.html"
    }
  ],
  "corpus": "r4b1t-cybersecurity-v1",
  "family": "defensive_resources",
  "rationale": "Proposed review: individual dated Malware Traffic Analysis packet-analysis exercises/reports for 2024. Year indexes, general navigation and unrelated links are omitted.",
  "schema": "r4b1t-reviewed-source-index-v1",
  "scope": "cybersecurity",
  "snapshot_digest": "sha256:393883847ce882531814a3e72f04e21c771e3d6c858c459f505eabdea9b95cbb",
  "snapshot_path": "corpus/indexes/mta2024-v1.json",
  "source_id": "mta2024-v1"
}
